{
  "contract_id": "AUERNYX.Pathfinder.Contract.v1",
  "schema_version": 1,
  "timestamp": "2026-01-01T00:00:00Z",
  "input": {
    "stage": "LOCK_FACTS",
    "case": {
      "case_id": "DEMO_CASE_STRATEGY_REVIEW_0001",
      "domain": "HOUSING",
      "location": {"city": "", "state": "CA"},
      "program": {"name": "HUD-VASH", "notes": ""},
      "timeline": {"today": "2026-01-01", "event_summary": ""},
      "narrative": "We have a draft plan, but we need to confirm it doesn’t assume eligibility or skip evidence.",
      "known_facts": [
        "User has a voucher letter (stated)",
        "Landlord asked for deposit before viewing"
      ],
      "unknowns": [
        "Do we have written confirmation of voucher status?",
        "Who actually owns/manages the unit?"
      ],
      "deadlines": [],
      "people": [{"role": "USER"}, {"role": "ADVOCATE"}]
    },
    "constraints": {
      "review_mode": "STRATEGY_REVIEW"
    },
    "artifacts": [
      {
        "artifact_id": "V1",
        "type": "VOUCHER_LETTER",
        "source": "portal screenshot",
        "received_date": "2025-12-30",
        "summary": "Voucher/program letter screenshot (redacted)",
        "redactions_applied": true
      }
    ],
    "flags": {
      "housing_instability": true,
      "deadline_risk": false,
      "fraud_or_phishing_risk": true,
      "privacy_risk": true
    },
    "config": {
      "enabled_modules": ["PF-Core", "PF-Governance", "PF-Truth"],
      "max_next_actions": 3,
      "plan_horizon_days": 7
    },
    "module_results": {
      "draft_strategy": {
        "notes": "Client is eligible and guaranteed approval; proceed immediately.",
        "assumptions": ["eligible", "guaranteed"]
      }
    }
  }
}
