{
  "contract_id": "AUERNYX.Pathfinder.Contract.v1",
  "schema_version": 1,
  "timestamp": "2026-01-01T00:00:00Z",
  "input": {
    "stage": "CLARIFY",
    "case": {
      "case_id": "DEMO_CASE_INTAKE_REVIEW_0001",
      "domain": "HOUSING",
      "location": {"city": "", "state": "CA"},
      "program": {"name": "HUD-VASH", "notes": "(as stated by user; unverified)"},
      "timeline": {"today": "2026-01-01", "event_summary": ""},
      "narrative": "I received a notice and I’m trying to figure out what’s real and what I need to prove before I act.",
      "known_facts": [
        "User received a written notice",
        "Deadline date is unclear",
        "Program may be HUD-VASH"
      ],
      "unknowns": [
        "Deadline date is unclear",
        "Who issued the notice?",
        "Is the program actually HUD-VASH or something else?"
      ],
      "deadlines": [],
      "people": [{"role": "USER"}]
    },
    "constraints": {
      "review_mode": "INTAKE_REVIEW"
    },
    "artifacts": [
      {
        "artifact_id": "A1",
        "type": "NOTICE_TO_VACATE",
        "source": "photo",
        "received_date": "2025-12-31",
        "summary": "Photo of notice (redacted)",
        "redactions_applied": true
      }
    ],
    "flags": {
      "housing_instability": true,
      "deadline_risk": true,
      "fraud_or_phishing_risk": false,
      "privacy_risk": true
    },
    "config": {
      "enabled_modules": ["PF-Core", "PF-Governance", "PF-Truth"],
      "max_next_actions": 3,
      "plan_horizon_days": 7
    },
    "module_results": {}
  }
}
