{
  "contract_id": "AUERNYX.Pathfinder.Contract.v1",
  "schema_version": 1,
  "timestamp": "2026-01-01T20:59:52.857436Z",
  "input": {
    "stage": "CLARIFY",
    "case": {
      "case_id": "DEMO_CASE_INTAKE_REVIEW_0001",
      "domain": "HOUSING",
      "location": {
        "city": "",
        "state": "CA"
      },
      "program": {
        "name": "HUD-VASH",
        "notes": "(as stated by user; unverified)"
      },
      "timeline": {
        "today": "2026-01-01",
        "event_summary": ""
      },
      "narrative": "I received a notice and I’m trying to figure out what’s real and what I need to prove before I act.",
      "known_facts": [
        "User received a written notice",
        "Deadline date is unclear",
        "Program may be HUD-VASH"
      ],
      "unknowns": [
        "Deadline date is unclear",
        "Who issued the notice?",
        "Is the program actually HUD-VASH or something else?"
      ],
      "deadlines": [],
      "people": [
        {
          "role": "USER"
        }
      ]
    },
    "constraints": {
      "review_mode": "INTAKE_REVIEW"
    },
    "artifacts": [
      {
        "artifact_id": "A1",
        "type": "NOTICE_TO_VACATE",
        "source": "photo",
        "received_date": "2025-12-31",
        "summary": "Photo of notice (redacted)",
        "redactions_applied": true
      }
    ],
    "flags": {
      "housing_instability": true,
      "deadline_risk": true,
      "fraud_or_phishing_risk": false,
      "privacy_risk": true
    },
    "config": {
      "enabled_modules": [
        "PF-Core",
        "PF-Governance",
        "PF-Truth"
      ],
      "max_next_actions": 3,
      "plan_horizon_days": 7
    },
    "module_results": {}
  },
  "output": {
    "stage": "CLARIFY",
    "confidence": "VERIFY_REQUIRED",
    "updates": [
      "Case review mode: INTAKE_REVIEW (truth review, not authorship).",
      "Key facts are missing; treat recommendations as verification steps.",
      "Deadline risk flagged; confirm dates from the notice/artifact."
    ],
    "tasks": [],
    "evidence": [],
    "scripts": [],
    "warnings": [
      {
        "warning_id": "BB4.CONTRADICTION.KNOWN_UNKNOWN_OVERLAP",
        "label": "Some items appear in both known facts and unknowns.",
        "details": "Deadline date is unclear",
        "severity": "MEDIUM",
        "confidence": "VERIFY_REQUIRED"
      },
      {
        "warning_id": "BB4.ASSUMPTION.PROGRAM_UNVERIFIED",
        "label": "Program name is present but not supported by an attached artifact.",
        "details": "Program listed: HUD-VASH. Attach a letter/portal screenshot if available.",
        "severity": "MEDIUM",
        "confidence": "VERIFY_REQUIRED"
      }
    ],
    "handoffs": [],
    "pathfinder_plan": {
      "situation": "I received a notice and I’m trying to figure out what’s real and what I need to prove before I act.\nKnown facts (as stated): User received a written notice; Deadline date is unclear; Program may be HUD-VASH\nUnknowns / questions: Deadline date is unclear; Who issued the notice?; Is the program actually HUD-VASH or something else?\nArtifacts present (types): NOTICE_TO_VACATE",
      "goal": "Intake review: separate stated facts from unknowns and define required evidence.",
      "next_3_actions": [
        "Review the intake for completeness: verify each stated fact is supported by an artifact or clearly marked as unverified.",
        "Prioritize the top 3 unknowns and define exactly what evidence would answer each.",
        "Check whether any written deadlines exist (notice/email/portal) and capture dates."
      ],
      "evidence_needed": [
        "Lease or rental agreement (if applicable), redacted.",
        "Relevant email/text thread screenshots showing dates/requests (redact phone numbers if needed).",
        "Program documentation you have (letters, portal screenshots) that state the program name and status.",
        "A one-page timeline: key dates, who you contacted, outcomes."
      ],
      "risks_traps": [
        "This output is review-oriented; a human must decide any next steps.",
        "Privacy: don’t share SSN, bank details, passwords/MFA codes, or full unredacted DD-214 in messages.",
        "Use redactions (last-4 only) when sharing documents or screenshots."
      ],
      "if_blocked_do_this": [
        "If you get stuck, collect the missing document or ask the responsible agency for the exact requirement in writing."
      ]
    }
  }
}
