{
  "contract_id": "AUERNYX.Pathfinder.Contract.v1",
  "schema_version": 1,
  "timestamp": "2026-01-01T20:59:54.454280Z",
  "input": {
    "stage": "LOCK_FACTS",
    "case": {
      "case_id": "DEMO_CASE_STRATEGY_REVIEW_0001",
      "domain": "HOUSING",
      "location": {
        "city": "",
        "state": "CA"
      },
      "program": {
        "name": "HUD-VASH",
        "notes": ""
      },
      "timeline": {
        "today": "2026-01-01",
        "event_summary": ""
      },
      "narrative": "We have a draft plan, but we need to confirm it doesn’t assume eligibility or skip evidence.",
      "known_facts": [
        "User has a voucher letter (stated)",
        "Landlord asked for deposit before viewing"
      ],
      "unknowns": [
        "Do we have written confirmation of voucher status?",
        "Who actually owns/manages the unit?"
      ],
      "deadlines": [],
      "people": [
        {
          "role": "USER"
        },
        {
          "role": "ADVOCATE"
        }
      ]
    },
    "constraints": {
      "review_mode": "STRATEGY_REVIEW"
    },
    "artifacts": [
      {
        "artifact_id": "V1",
        "type": "VOUCHER_LETTER",
        "source": "portal screenshot",
        "received_date": "2025-12-30",
        "summary": "Voucher/program letter screenshot (redacted)",
        "redactions_applied": true
      }
    ],
    "flags": {
      "housing_instability": true,
      "deadline_risk": false,
      "fraud_or_phishing_risk": true,
      "privacy_risk": true
    },
    "config": {
      "enabled_modules": [
        "PF-Core",
        "PF-Governance",
        "PF-Truth"
      ],
      "max_next_actions": 3,
      "plan_horizon_days": 7
    },
    "module_results": {
      "draft_strategy": {
        "notes": "Client is eligible and guaranteed approval; proceed immediately.",
        "assumptions": [
          "eligible",
          "guaranteed"
        ]
      }
    }
  },
  "output": {
    "stage": "LOCK_FACTS",
    "confidence": "VERIFY_REQUIRED",
    "updates": [
      "Case review mode: STRATEGY_REVIEW (truth review, not authorship).",
      "Key facts are missing; treat recommendations as verification steps.",
      "Fraud risk flagged; avoid sending money or sensitive info until verified."
    ],
    "tasks": [],
    "evidence": [],
    "scripts": [],
    "warnings": [
      {
        "warning_id": "BB4.ELIGIBILITY.CLAIM_DETECTED",
        "label": "Eligibility/guarantee language detected in module results.",
        "details": "Treat eligibility as verify-required; do not assume program acceptance without written confirmation.",
        "severity": "HIGH",
        "confidence": "VERIFY_REQUIRED"
      }
    ],
    "handoffs": [],
    "pathfinder_plan": {
      "situation": "We have a draft plan, but we need to confirm it doesn’t assume eligibility or skip evidence.\nKnown facts (as stated): User has a voucher letter (stated); Landlord asked for deposit before viewing\nUnknowns / questions: Do we have written confirmation of voucher status?; Who actually owns/manages the unit?\nArtifacts present (types): VOUCHER_LETTER",
      "goal": "Strategy review: verify alignment to intake; flag assumptions and eligibility claims for human review.",
      "next_3_actions": [
        "Review proposed steps (if any) and label each as blocking vs non-blocking before acting.",
        "Verify no strategy assumes eligibility, program availability, or guarantees; mark those as 'verify-required'.",
        "Ensure the strategy is consistent with intake facts/unknowns and does not skip required evidence collection."
      ],
      "evidence_needed": [
        "Any written notice(s) (eviction/termination/shutoff): photo/PDF with dates visible (redact identifiers).",
        "Lease or rental agreement (if applicable), redacted.",
        "Relevant email/text thread screenshots showing dates/requests (redact phone numbers if needed).",
        "Program documentation you have (letters, portal screenshots) that state the program name and status.",
        "A one-page timeline: key dates, who you contacted, outcomes."
      ],
      "risks_traps": [
        "Do not assume eligibility or program availability; require written confirmation.",
        "This output is review-oriented; a human must decide any next steps.",
        "Fraud risk: don’t send money (wire, gift cards, crypto) or sensitive info until you verify identity and ownership.",
        "If someone is pressuring you to pay to apply/view, treat it as a red flag and verify via independent channels.",
        "Privacy: don’t share SSN, bank details, passwords/MFA codes, or full unredacted DD-214 in messages.",
        "Use redactions (last-4 only) when sharing documents or screenshots."
      ],
      "if_blocked_do_this": [
        "If you get stuck, collect the missing document or ask the responsible agency for the exact requirement in writing."
      ]
    }
  }
}
